"idx","publication","doc_id","title","publication_date","priority_date","inventors","secondary_inventors","applicants","secondary_applicants","application_number","priority_numbers","also_published_as","classification","abstract","biblio_link","description_link","claims_link","mosaics_link","original_document_link","cited_documents_link","citing_documents_link","legal_status_link","inpadoc_family_link","description_length_exact","claims_length_exact","mosaic_pages","original_pages"
"28","EP3185821 (A1)","EP3185821A1","IMPACTOR BODY FOR ORTHOPAEDIC SURGERY OPERATION","2017-07-05","2014-08-26","THULIEZ JEAN-LUC [CH]; CROZIER ETIENNE [CH]; ROSSE YANN [CH]; OBLIGER NICOLAS [CH]","(THULIEZ, Jean-Luc; OBLIGER, Nicolas; CROZIER, Etienne; ROSSE, Yann; THULIEZ, Jean-Luc; OBLIGER, Nicolas; CROZIER, Etienne; ROSSE, Yann)","MPS PRECIMED SA [CH]","(MPS Precimed SA; MPS Precimed SA)","Numéro de demande EP20150775494 20150824 Dossier global","Numéro(s) de priorité: WO2014IB64062 20140826 ; WO2015IB56408 20150824 ;","Également publié en tant que: EP3185821 (A1) EP3185821 (B1) WO2016030809 (A1) EP3185821 (A1) EP3185821 (B1) WO2016030809 (A1) moins","Classification: - internationale A61F2/46 - coopérative A61F2/4609 (EP); A61F2002/30471 (EP); A61F2002/30522 (EP); A61F2002/4627 (EP); A61F2002/4629 (EP); A61F2002/4681 (EP)","","https://worldwide.espacenet.com/publicationDetails/biblio?II=27&ND=3&adjacent=true&locale=fr_EP&FT=D&date=20170705&CC=EP&NR=3185821A1&KC=A1","https://worldwide.espacenet.com/publicationDetails/description?CC=EP&NR=3185821A1&KC=A1&FT=D&ND=3&date=20170705&DB=&locale=fr_EP","https://worldwide.espacenet.com/publicationDetails/claims?CC=EP&NR=3185821A1&KC=A1&FT=D&ND=3&date=20170705&DB=&locale=fr_EP","https://worldwide.espacenet.com/publicationDetails/mosaics?CC=EP&NR=3185821A1&KC=A1&FT=D&ND=3&date=20170705&DB=&locale=fr_EP","https://worldwide.espacenet.com/publicationDetails/originalDocument?CC=EP&NR=3185821A1&KC=A1&FT=D&ND=3&date=20170705&DB=&locale=fr_EP","https://worldwide.espacenet.com/publicationDetails/citedDocuments?CC=EP&NR=3185821A1&KC=A1&FT=D&ND=3&date=20170705&DB=&locale=fr_EP","https://worldwide.espacenet.com/publicationDetails/citingDocuments?CC=EP&NR=3185821A1&KC=A1&FT=D&ND=3&date=20170705&DB=&locale=fr_EP","https://worldwide.espacenet.com/publicationDetails/inpadoc?CC=EP&NR=3185821A1&KC=A1&FT=D&ND=3&date=20170705&DB=&locale=fr_EP","https://worldwide.espacenet.com/publicationDetails/inpadocPatentFamily?CC=EP&NR=3185821A1&KC=A1&FT=D&ND=3&date=20170705&DB=&locale=fr_EP","9546","2290","2","22"
"29","WO2016004540 (A1)","WO2016004540A1","OPTICAL METHOD FOR MAKING AT LEAST ONE COMPONENT OF A WATCH MOVEMENT INVISIBLE","2016-01-14","2014-07-09","THULIEZ JEAN-LUC [CH]; PERRIN JEAN-LUC [CH]; CROZIER ETIENNE [CH]; PINTUS MICKE [FR]; PINTUS YANNICK [CH]","(PINTUS, YANNICK; PINTUS, MICKE; PERRIN, JEAN-LUC; CROZIER, ETIENNE; THULIEZ, JEAN-LUC)","RICHEMONT INT SA [CH]","(RICHEMONT INTERNATIONAL SA)","Numéro de demande WO2014CH00098 20140709 Dossier global","Numéro(s) de priorité: WO2014CH00098 20140709 ;","Également publié en tant que: WO2016004540 (A1) WO2016004540 (A1) moins","Classification: - internationale G04B29/02; G04B45/02; G04B45/04 - coopérative G04B17/285 (EP); G04B29/022 (EP); G04B45/02 (EP); G04B45/04 (EP)","The invention relates to a method for making at least one component of a watch movement (11) invisible, which watch movement is accommodated inside a housing (12) of a watch (10) which is closed at least on the front surface thereof by means of a watch glass (25) made of sapphire, diamond or the like. Said component is advantageously the upper bridge (17) of this mechanical movement (11). Advantageously, the spectral transmission curve of said watch glass (25) is measured and said component is processed at least once such that the spectral transmission curve thereof at least approximately matches that of the watch glass (25). This processing comprises placing for example three stacked layers of antireflective materials (25a, 25b, 25c) on both the glass (25) of a watch (10) and the component to be made invisible.","https://worldwide.espacenet.com/publicationDetails/biblio?II=28&ND=3&adjacent=true&locale=fr_EP&FT=D&date=20160114&CC=WO&NR=2016004540A1&KC=A1","https://worldwide.espacenet.com/publicationDetails/description?CC=WO&NR=2016004540A1&KC=A1&FT=D&ND=3&date=20160114&DB=&locale=fr_EP","https://worldwide.espacenet.com/publicationDetails/claims?CC=WO&NR=2016004540A1&KC=A1&FT=D&ND=3&date=20160114&DB=&locale=fr_EP","https://worldwide.espacenet.com/publicationDetails/mosaics?CC=WO&NR=2016004540A1&KC=A1&FT=D&ND=3&date=20160114&DB=&locale=fr_EP","https://worldwide.espacenet.com/publicationDetails/originalDocument?CC=WO&NR=2016004540A1&KC=A1&FT=D&ND=3&date=20160114&DB=&locale=fr_EP","https://worldwide.espacenet.com/publicationDetails/citedDocuments?CC=WO&NR=2016004540A1&KC=A1&FT=D&ND=3&date=20160114&DB=&locale=fr_EP","https://worldwide.espacenet.com/publicationDetails/citingDocuments?CC=WO&NR=2016004540A1&KC=A1&FT=D&ND=3&date=20160114&DB=&locale=fr_EP","https://worldwide.espacenet.com/publicationDetails/inpadoc?CC=WO&NR=2016004540A1&KC=A1&FT=D&ND=3&date=20160114&DB=&locale=fr_EP","https://worldwide.espacenet.com/publicationDetails/inpadocPatentFamily?CC=WO&NR=2016004540A1&KC=A1&FT=D&ND=3&date=20160114&DB=&locale=fr_EP","18828","5075","1","25"
"30","US2015360014 (A1)","US2015360014A1","Applicator and capsule for such applicator","2015-12-17","2014-06-16","HEISEL GUILLAUME [CH]; DECAUX STÉPHANE [FR]; DECAUX GÉRALDINE [FR]; CROZIER ETIENNE [CH]; THULIEZ JEAN LUC [CH]","(DECAUX STÉPHANE; DECAUX GÉRALDINE; THULIEZ JEAN LUC; CROZIER ETIENNE; HEISEL GUILLAUME; Decaux, Stéphane; Decaux, Géraldine; Thuliez, Jean Luc; Crozier, Etienne; Heisel, Guillaume)","INDERM [FR]; ID LAB [FR]","(ID LAB; InDerm; ID Lab)","Numéro de demande US201414310083 20140620 Dossier global","Numéro(s) de priorité: US201414310083 20140620 ; US201462012568P 20140616 ;","Également publié en tant que: CN106659282 (A) CN106659282 (B) EP3154623 (A1) EP3154623 (B1) EP3154623 (B8) plus CN106659282 (A) CN106659282 (B) EP3154623 (A1) EP3154623 (B1) EP3154623 (B8) ES2895898 (T3) JP2017522935 (A) JP6596028 (B2) US10667985 (B2) US2017128319 (A1) WO2015193303 (A1) moins","Classification: - internationale A45D34/00; A45D34/04; A45D40/26; A61H15/00; A61H15/02; A61H23/02; A61K9/00; A61M35/00; A61N5/06 - coopérative A45D2034/005 (EP, CN, US); A45D2200/205 (EP, CN, US); A45D34/00 (EP, US); A45D34/04 (EP, CN, US); A45D34/041 (EP, CN, US); A45D40/261 (US); A61H15/0085 (EP, CN, US); A61H15/02 (EP, CN, US); A61H2015/0042 (EP, CN, US); A61H2201/10 (EP, CN, US); A61H2201/105 (EP, CN, US); A61H2201/1215 (EP, CN, US); A61H2201/1246 (EP, CN, US); A61H23/0245 (EP, CN, US); A61H23/0254 (EP, CN, US); A61K9/00 (EP, US); A61M2037/0007 (EP, CN, US); A61M35/003 (EP, CN, US); A61N2005/0631 (EP, CN, US); A61N2005/0644 (EP, CN, US); A61N5/06 (EP, US); A61N5/0616 (EP, CN, US);","[0001] A device for distributing, on a surface of a living body, a product containing an active component or forming a cosmetic product, the device comprising a housing and a cartridge, releasably coupled to the housing, wherein:the cartridge comprises an applicator element and a reservoir containing said product and having a movable or deformable wall part for reducing the volume of the reservoir, wherein at least one opening is provided between the reservoir and the applicator element for applying the product to the applicator element by reducing the volume of the reservoir; andthe housing comprises at least one light source for radiating light through and/or alongside the cartridge and a drive for driving the movable and/or deformable wall part of the reservoir for reducing the volume of the reservoir.","https://worldwide.espacenet.com/publicationDetails/biblio?II=29&ND=3&adjacent=true&locale=fr_EP&FT=D&date=20151217&CC=US&NR=2015360014A1&KC=A1","https://worldwide.espacenet.com/publicationDetails/description?CC=US&NR=2015360014A1&KC=A1&FT=D&ND=3&date=20151217&DB=&locale=fr_EP","https://worldwide.espacenet.com/publicationDetails/claims?CC=US&NR=2015360014A1&KC=A1&FT=D&ND=3&date=20151217&DB=&locale=fr_EP","https://worldwide.espacenet.com/publicationDetails/mosaics?CC=US&NR=2015360014A1&KC=A1&FT=D&ND=3&date=20151217&DB=&locale=fr_EP","https://worldwide.espacenet.com/publicationDetails/originalDocument?CC=US&NR=2015360014A1&KC=A1&FT=D&ND=3&date=20151217&DB=&locale=fr_EP","https://worldwide.espacenet.com/publicationDetails/citedDocuments?CC=US&NR=2015360014A1&KC=A1&FT=D&ND=3&date=20151217&DB=&locale=fr_EP","https://worldwide.espacenet.com/publicationDetails/citingDocuments?CC=US&NR=2015360014A1&KC=A1&FT=D&ND=3&date=20151217&DB=&locale=fr_EP","https://worldwide.espacenet.com/publicationDetails/inpadoc?CC=US&NR=2015360014A1&KC=A1&FT=D&ND=3&date=20151217&DB=&locale=fr_EP","https://worldwide.espacenet.com/publicationDetails/inpadocPatentFamily?CC=US&NR=2015360014A1&KC=A1&FT=D&ND=3&date=20151217&DB=&locale=fr_EP","98431","8197","6","52"
"31","US2015342657 (A1)","US2015342657A1","BONE FIXATION ASSEMBLY","2015-12-03","2014-05-30","THULIEZ JEAN-LUC [CH]; VOISARD CYRIL [CH]; OBLIGER NICOLAS [FR]; MOOTIEN AZAGEN [FR]; CROZIER ETIENNE [CH]","(VOISARD CYRIL; MOOTIEN AZAGEN; CROZIER ETIENNE; THULIEZ JEAN-LUC; OBLIGER NICOLAS; Voisard Cyril; Mootien Azagen; Crozier Etienne; Thuliez Jean-Luc; Obliger Nicolas)","DEPUY SYNTHES PRODUCTS INC [US]","(DEPUY SYNTHES PRODUCTS, INC.; DePuy Synthes Products, Inc.)","Numéro de demande US201514704658 20150505 Dossier global","Numéro(s) de priorité: US201462005552P 20140530 ; US201514704658 20150505 ;","Également publié en tant que: AU2015267531 (A1) AU2015267531 (B2) CA2950706 (A1) CN106470628 (A) CN106470628 (B) plus AU2015267531 (A1) AU2015267531 (B2) CA2950706 (A1) CN106470628 (A) CN106470628 (B) EP3148462 (A1) EP3148462 (B1) JP2017520359 (A) JP6571174 (B2) US9603646 (B2) WO2015183485 (A1) moins","Classification: - internationale A61B17/58; A61B17/60; A61B17/82; A61B17/84; A61B17/88; A61F2/00 - coopérative A61B17/823 (EP, CN, US); A61B17/842 (EP, CN, US); A61B17/8861 (EP, CN, US); A61B17/8863 (EP, CN, US); A61B17/8869 (EP, CN, US); A61B17/8872 (EP, CN, US)","A bone fixation system includes at least one bone fixation member and a bone fixation instrument. The bone fixation member includes a strap and a locking mechanism. The strap can be pulled through the locking mechanism so as to form a loop about a target bone so as to secure first and second bone segments in an approximated, compressed configuration. The bone fixation instrument is configured to apply tension to the loop about the target bone. The fixation instrument includes a tension assembly that is configured to secure a free end of the bone fixation member to the fixation instrument. The tension assembly is further configured to pull the free end so as to increase tension in the loop while the tension in the loop is less than a select tension. The tension assembly is unable to further increase tension in the bone fixation member once the tension in the bone fixation member has reached the select tension. The fixation instrument further includes a cutter assembly that is configured to cut the free end of the bone fixation member so as to separate the free end from the loop.","https://worldwide.espacenet.com/publicationDetails/biblio?II=30&ND=3&adjacent=true&locale=fr_EP&FT=D&date=20151203&CC=US&NR=2015342657A1&KC=A1","https://worldwide.espacenet.com/publicationDetails/description?CC=US&NR=2015342657A1&KC=A1&FT=D&ND=3&date=20151203&DB=&locale=fr_EP","https://worldwide.espacenet.com/publicationDetails/claims?CC=US&NR=2015342657A1&KC=A1&FT=D&ND=3&date=20151203&DB=&locale=fr_EP","https://worldwide.espacenet.com/publicationDetails/mosaics?CC=US&NR=2015342657A1&KC=A1&FT=D&ND=3&date=20151203&DB=&locale=fr_EP","https://worldwide.espacenet.com/publicationDetails/originalDocument?CC=US&NR=2015342657A1&KC=A1&FT=D&ND=3&date=20151203&DB=&locale=fr_EP","https://worldwide.espacenet.com/publicationDetails/citedDocuments?CC=US&NR=2015342657A1&KC=A1&FT=D&ND=3&date=20151203&DB=&locale=fr_EP","https://worldwide.espacenet.com/publicationDetails/citingDocuments?CC=US&NR=2015342657A1&KC=A1&FT=D&ND=3&date=20151203&DB=&locale=fr_EP","https://worldwide.espacenet.com/publicationDetails/inpadoc?CC=US&NR=2015342657A1&KC=A1&FT=D&ND=3&date=20151203&DB=&locale=fr_EP","https://worldwide.espacenet.com/publicationDetails/inpadocPatentFamily?CC=US&NR=2015342657A1&KC=A1&FT=D&ND=3&date=20151203&DB=&locale=fr_EP","52429","8452","4","31"
"32","AU2014274521 (A1)","AU2014274521A1","Device and method for producing a frothed liquid from soluble ingredients and diluent","2015-01-22","2006-12-11","GUGERLI RAPHAEL; HARRISON DAVID J; BERNHARDSGRUETTER RAPHAEL; THULIEZ JEAN-LUC; KISSLING IWAN; DOGAN NIHAN; BEAUSIRE CEDRIC; HAMEL DAVID","(GUGERLI, RAPHAEL; THULIEZ, JEAN-LUC; KISSLING, IWAN; BERNHARDSGRUETTER, RAPHAEL; BEAUSIRE, CEDRIC; DOGAN, NIHAN; HARRISON, DAVID J.; HAMEL, DAVID; Gugerli, Raphael; Thuliez, Jean-Luc; Kissling, Iwan; Bernhardsgruetter, Raphael; Beausire, Cedric; Dogan, Nihan; Harrison, David J.; Hamel, David)","NESTEC SA [CH]; NESTEC SA","(NESTEC S.A.; NESTEC S.A.)","Numéro de demande AU20140274521 20141209","Numéro(s) de priorité: AU20070332588 20071206 ; AU20140274521 20141209 ; EP20060125772 20061211 ; WO2007EP63391 20071206 ;","Également publié en tant que: AU2014274521 (B2) AU2014274521 (B2) moins","Classification: - internationale A47J31/40 - coopérative","Abstract Device for producing a frothed liquid comprising a chamber 13 opened to atmosphere with a transverse bottom wall 14 and a longitudinal upward wall 15, at least one diluent inlet 18, at least one liquid delivery outlet 20, wherein the diluent inlet is provided through the upward wall and is dimensioned and oriented for directing a thin jet of diluent in the chamber, and wherein the at least one liquid delivery outlet is configured in the bottom wall for liquid to rise up along the side of the upward wall by the jet of diluent entering the chamber as a result of the direction and dimension of the diluent inlet in the chamber. Figure 2 B 22m B A-+ f","https://worldwide.espacenet.com/publicationDetails/biblio?II=31&ND=3&adjacent=true&locale=fr_EP&FT=D&date=20150122&CC=AU&NR=2014274521A1&KC=A1","https://worldwide.espacenet.com/publicationDetails/description?CC=AU&NR=2014274521A1&KC=A1&FT=D&ND=3&date=20150122&DB=&locale=fr_EP","https://worldwide.espacenet.com/publicationDetails/claims?CC=AU&NR=2014274521A1&KC=A1&FT=D&ND=3&date=20150122&DB=&locale=fr_EP","https://worldwide.espacenet.com/publicationDetails/mosaics?CC=AU&NR=2014274521A1&KC=A1&FT=D&ND=3&date=20150122&DB=&locale=fr_EP","https://worldwide.espacenet.com/publicationDetails/originalDocument?CC=AU&NR=2014274521A1&KC=A1&FT=D&ND=3&date=20150122&DB=&locale=fr_EP","https://worldwide.espacenet.com/publicationDetails/citedDocuments?CC=AU&NR=2014274521A1&KC=A1&FT=D&ND=3&date=20150122&DB=&locale=fr_EP","https://worldwide.espacenet.com/publicationDetails/citingDocuments?CC=AU&NR=2014274521A1&KC=A1&FT=D&ND=3&date=20150122&DB=&locale=fr_EP","https://worldwide.espacenet.com/publicationDetails/inpadoc?CC=AU&NR=2014274521A1&KC=A1&FT=D&ND=3&date=20150122&DB=&locale=fr_EP","https://worldwide.espacenet.com/publicationDetails/inpadocPatentFamily?CC=AU&NR=2014274521A1&KC=A1&FT=D&ND=3&date=20150122&DB=&locale=fr_EP","46424","13426","2","41"
"33","US2016000570 (A1)","US2016000570A1","Polymer based joint implants and method of manufacture","2016-01-07","2013-03-15","THULIEZ JEAN-LUC [CH]; AYLIFFE JOHN NICHOLAS [CH]","(THULIEZ JEAN-LUC; AYLIFFE JOHN NICHOLAS; THULIEZ Jean-Luc; AYLIFFE John Nicholas; Thuliez, Jean-Luc; Ayliffe, John Nicholas)","SWISS IDEA BOX SARL [CH]","(SWISS IDEA BOX SARL; SWISS IDEA BOX SARL; SWISS IDEA BOX SARL)","Numéro de demande US201414776839 20140314 Dossier global","Numéro(s) de priorité: US201361787270P 20130315 ; US201414776839 20140314 ; WO2014IB00359 20140314 ;","Également publié en tant que: US10058429 (B2) US2016317310 (A9) WO2014140773 (A2) WO2014140773 (A3) WO2014140773 (A4) US10058429 (B2) US2016317310 (A9) WO2014140773 (A2) WO2014140773 (A3) WO2014140773 (A4) moins","Classification: - internationale A61F2/30; A61F2/38; A61L27/18; A61L27/30; A61L27/44; A61L27/50; A61L27/54; A61L27/56 - coopérative A61F2/30 (US); A61F2/3094 (EP, US); A61F2/30965 (US); A61F2/38 (EP, US); A61F2/3859 (US); A61F2/389 (US); A61F2002/30011 (EP, US); A61F2002/30016 (US); A61F2002/30624 (US); A61F2002/30971 (US); A61F2002/3863 (US); A61F2310/0058 (EP, US); A61L2300/104 (EP, US); A61L2430/24 (EP, US); A61L27/18 (EP, US); A61L27/303 (EP, US); A61L27/443 (EP, US); A61L27/50 (EP, US); A61L27/54 (EP, US); A61L27/56 (US);","A method and implant based on injection molding techniques. The method produces polymeric components suitable for implantation with a structure and mechanical properties close to those of natural bone tissue. In a variant, method for making an implant or component thereof includes forming a standard shape foamed blank, and over-molding a thin layer of non-foamed PEEK material onto the standard shaped foamed blank to obtain a final implant component geometry, whereby the blank is completely encapsulated by the over-molded layer.","https://worldwide.espacenet.com/publicationDetails/biblio?II=32&ND=3&adjacent=true&locale=fr_EP&FT=D&date=20160107&CC=US&NR=2016000570A1&KC=A1","https://worldwide.espacenet.com/publicationDetails/description?CC=US&NR=2016000570A1&KC=A1&FT=D&ND=3&date=20160107&DB=&locale=fr_EP","https://worldwide.espacenet.com/publicationDetails/claims?CC=US&NR=2016000570A1&KC=A1&FT=D&ND=3&date=20160107&DB=&locale=fr_EP","https://worldwide.espacenet.com/publicationDetails/mosaics?CC=US&NR=2016000570A1&KC=A1&FT=D&ND=3&date=20160107&DB=&locale=fr_EP","https://worldwide.espacenet.com/publicationDetails/originalDocument?CC=US&NR=2016000570A1&KC=A1&FT=D&ND=3&date=20160107&DB=&locale=fr_EP","https://worldwide.espacenet.com/publicationDetails/citedDocuments?CC=US&NR=2016000570A1&KC=A1&FT=D&ND=3&date=20160107&DB=&locale=fr_EP","https://worldwide.espacenet.com/publicationDetails/citingDocuments?CC=US&NR=2016000570A1&KC=A1&FT=D&ND=3&date=20160107&DB=&locale=fr_EP","https://worldwide.espacenet.com/publicationDetails/inpadoc?CC=US&NR=2016000570A1&KC=A1&FT=D&ND=3&date=20160107&DB=&locale=fr_EP","https://worldwide.espacenet.com/publicationDetails/inpadocPatentFamily?CC=US&NR=2016000570A1&KC=A1&FT=D&ND=3&date=20160107&DB=&locale=fr_EP","68175","4988","3","27"
"34","CH707437 (A1)","CH707437A1","Method for allowing e.g. lower bridge of movement of e.g. wrist watch to be invisible in spectrum of visible wavelengths, involves performing treatment e.g. antireflective treatment, of watch glass to reduce light reflected by component","2014-07-15","2013-01-10","THULIEZ JEAN-LUC [CH]; JEAN-LUC PERRIN [CH]; ETIENNE CROZIER [CH]; PERRIN JEAN-LUC [CH]; JEAN-LUC THULIEZ [CH]; CROZIER ETIENNE [CH]; MICKE PINTUS [FR]; YANNICK PINTUS [CH]; PINTUS MICKE [FR]; PINTUS YANNICK [CH]","(YANNICK PINTUS; MICKE PINTUS; JEAN-LUC PERRIN; ETIENNE CROZIER; JEAN-LUC THULIEZ; Yannick Pintus; Micke Pintus; Jean-Luc Perrin; Etienne Crozier; Jean-Luc Thuliez)","RICHEMONT INT SA [CH]","(RICHEMONT INTERNATIONAL SA; RICHEMONT INTERNATIONAL SA)","Numéro de demande CH20130000106 20130110","Numéro(s) de priorité: CH20130000106 20130110 ;","Également publié en tant que: CH707437 (A1) CH707437 (B1) CH707437 (A1) CH707437 (B1) moins","Classification: - internationale G04B29/02; G04B45/02; G04B45/04 - coopérative G04B29/022 (EP, CH); G04B45/02 (EP, CH); G04B45/04 (CH)","The method involves performing treatment e.g. antireflective treatment, of watch glass (25) to reduce light reflected by a component of mechanical movement (11) of watch (10) and passage of the light through the watch glass, where the component is made of transparent material. The antireflective treatment is performed such that a spectral transmission curve of the component is granted to that of the watch glass for reducing a reflecting surface of the component of the watch.","https://worldwide.espacenet.com/publicationDetails/biblio?II=33&ND=3&adjacent=true&locale=fr_EP&FT=D&date=20140715&CC=CH&NR=707437A1&KC=A1","https://worldwide.espacenet.com/publicationDetails/description?CC=CH&NR=707437A1&KC=A1&FT=D&ND=3&date=20140715&DB=&locale=fr_EP","https://worldwide.espacenet.com/publicationDetails/claims?CC=CH&NR=707437A1&KC=A1&FT=D&ND=3&date=20140715&DB=&locale=fr_EP","https://worldwide.espacenet.com/publicationDetails/mosaics?CC=CH&NR=707437A1&KC=A1&FT=D&ND=3&date=20140715&DB=&locale=fr_EP","https://worldwide.espacenet.com/publicationDetails/originalDocument?CC=CH&NR=707437A1&KC=A1&FT=D&ND=3&date=20140715&DB=&locale=fr_EP","https://worldwide.espacenet.com/publicationDetails/citedDocuments?CC=CH&NR=707437A1&KC=A1&FT=D&ND=3&date=20140715&DB=&locale=fr_EP","https://worldwide.espacenet.com/publicationDetails/citingDocuments?CC=CH&NR=707437A1&KC=A1&FT=D&ND=3&date=20140715&DB=&locale=fr_EP","https://worldwide.espacenet.com/publicationDetails/inpadoc?CC=CH&NR=707437A1&KC=A1&FT=D&ND=3&date=20140715&DB=&locale=fr_EP","https://worldwide.espacenet.com/publicationDetails/inpadocPatentFamily?CC=CH&NR=707437A1&KC=A1&FT=D&ND=3&date=20140715&DB=&locale=fr_EP","16583","5060","1","11"
"35","EP2745749 (A1)","EP2745749A1","Device for preparing a drink","2014-06-25","2012-12-21","HEISEL GUILLAUME [CH]; THULIEZ JEAN-LUC [CH]; CROZIER ETIENNE [CH]; AFFOLTER ROLAND [CH]","(AFFOLTER, ROLAND; CROZIER, ETIENNE; HEISEL, GUILLAUME; THULIEZ, JEAN-LUC; AFFOLTER, ROLAND; CROZIER, ETIENNE; HEISEL, GUILLAUME; THULIEZ, JEAN-LUC)","DELICA AG [CH]","(DELICA AG; DELICA AG)","Numéro de demande EP20120199045 20121221 Dossier global","Numéro(s) de priorité: EP20120199045 20121221 ;","Également publié en tant que: EP2745749 (A1) EP2745749 (B1) ES2605107 (T3) EP2745749 (A1) EP2745749 (B1) ES2605107 (T3) moins","Classification: - internationale A47J31/06 - coopérative A47J31/3633 (EP)","The device has movable chambers which are moved relative to each other between open position and closed position. A brewing chamber is formed with portion for receiving package, in a closed position. A supply line and discharge line are provided for passing a liquid medium through the chamber. An actuating element (7) is used to create open position and closed position through a gear (8) with a chamber in operative connection. An actuating element is displaceable along a linear or curved guide track (9).","https://worldwide.espacenet.com/publicationDetails/biblio?II=34&ND=3&adjacent=true&locale=fr_EP&FT=D&date=20140625&CC=EP&NR=2745749A1&KC=A1","https://worldwide.espacenet.com/publicationDetails/description?CC=EP&NR=2745749A1&KC=A1&FT=D&ND=3&date=20140625&DB=&locale=fr_EP","https://worldwide.espacenet.com/publicationDetails/claims?CC=EP&NR=2745749A1&KC=A1&FT=D&ND=3&date=20140625&DB=&locale=fr_EP","https://worldwide.espacenet.com/publicationDetails/mosaics?CC=EP&NR=2745749A1&KC=A1&FT=D&ND=3&date=20140625&DB=&locale=fr_EP","https://worldwide.espacenet.com/publicationDetails/originalDocument?CC=EP&NR=2745749A1&KC=A1&FT=D&ND=3&date=20140625&DB=&locale=fr_EP","https://worldwide.espacenet.com/publicationDetails/citedDocuments?CC=EP&NR=2745749A1&KC=A1&FT=D&ND=3&date=20140625&DB=&locale=fr_EP","https://worldwide.espacenet.com/publicationDetails/citingDocuments?CC=EP&NR=2745749A1&KC=A1&FT=D&ND=3&date=20140625&DB=&locale=fr_EP","https://worldwide.espacenet.com/publicationDetails/inpadoc?CC=EP&NR=2745749A1&KC=A1&FT=D&ND=3&date=20140625&DB=&locale=fr_EP","https://worldwide.espacenet.com/publicationDetails/inpadocPatentFamily?CC=EP&NR=2745749A1&KC=A1&FT=D&ND=3&date=20140625&DB=&locale=fr_EP","16592","3263","2","15"
