"idx","publication","doc_id","title","publication_date","priority_date","inventors","secondary_inventors","applicants","secondary_applicants","application_number","priority_numbers","also_published_as","classification","abstract","biblio_link","description_link","claims_link","mosaics_link","original_document_link","cited_documents_link","citing_documents_link","legal_status_link","inpadoc_family_link","description_length_exact","claims_length_exact","mosaic_pages","original_pages"
"19","US2019223656 (A1)","US2019223656A1","Beverage preparation machine with a controlled pump","2019-07-25","2016-06-30","THULIEZ JEAN-LUC [CH]; OBLIGER NICOLAS [FR]; CROZIER ETIENNE [CH]; GUYON BERTRAND [FR]; MAGATTI MARCO [CH]","(Crozier, Etienne; Guyon, Bertrand; Magatti, Marco; Obliger, Nicolas; Thuliez, Jean-Luc; Crozier, Etienne; Guyon, Bertrand; Magatti, Marco; Obliger, Nicolas; Thuliez, Jean-Luc)","NESTEC SA [CH]; NESTLE SA [CH]","(NESTEC S.A.; NESTEC S.A.; Societe des Produits Nestle S.A.)","Numéro de demande US201716312349 20170616 Dossier global","Numéro(s) de priorité: EP20160177217 20160630 ; WO2017EP64732 20170616 ;","Également publié en tant que: AU2017288698 (A1) AU2017288698 (B2) CA3028533 (A1) CN109310230 (A) CN109310230 (B) plus AU2017288698 (A1) AU2017288698 (B2) CA3028533 (A1) CN109310230 (A) CN109310230 (B) EP3478135 (A1) EP3478135 (B1) ES2797173 (T3) JP2019524183 (A) JP7370136 (B2) PT3478135 (T) RU2019102388 (A) RU2019102388 (A3) RU2760900 (C2) US11178999 (B2) WO2018001750 (A1) moins","Classification: - internationale A47J31/34; A47J31/46; A47J31/52 - coopérative A47J31/34 (RU, US); A47J31/3623 (US); A47J31/3633 (EP, RU); A47J31/46 (EP, RU); A47J31/468 (RU, US); A47J31/525 (EP, RU, US); A47J31/5251 (EP, RU, US); A47J31/5253 (EP, RU, US); A47J31/5255 (EP, RU, US);","[0001] A beverage preparation machine (1) comprises a source of liquid (2,3) and a dispensing outlet (4) connected via a pump (10) that includes a chamber (11) and a displaceable wall (12) delimiting the chamber (11). The pump (10) further has: an electric actuator (13) driving the displaceable wall (12) for causing an inflow of liquid from the source into the chamber (11) and for causing an outflow of liquid from the chamber (11) to the dispensing outlet (4); and a powering unit (14) that comprises an electric power source (142) and that is configured for supplying power to the actuator (13). The powering unit (14) further comprises: a sensor (143) for measuring an electrical parameter representative of a consumption of power by the actuator (13); and a control unit (144) that is connected to the sensor (143) and to the electrical power source (142) and that is configured to control the power supplied to the actuator (13) by the electric power source (142) as a function of: the measured parameter; and a desired liquid input into the chamber (11) and/or liquid output from the chamber (11), such as a desired flow and/or pressure of the liquid input and/or of the liquid output.","https://worldwide.espacenet.com/publicationDetails/biblio?II=18&ND=3&adjacent=true&locale=fr_EP&FT=D&date=20190725&CC=US&NR=2019223656A1&KC=A1","https://worldwide.espacenet.com/publicationDetails/description?CC=US&NR=2019223656A1&KC=A1&FT=D&ND=3&date=20190725&DB=&locale=fr_EP","https://worldwide.espacenet.com/publicationDetails/claims?CC=US&NR=2019223656A1&KC=A1&FT=D&ND=3&date=20190725&DB=&locale=fr_EP","https://worldwide.espacenet.com/publicationDetails/mosaics?CC=US&NR=2019223656A1&KC=A1&FT=D&ND=3&date=20190725&DB=&locale=fr_EP","https://worldwide.espacenet.com/publicationDetails/originalDocument?CC=US&NR=2019223656A1&KC=A1&FT=D&ND=3&date=20190725&DB=&locale=fr_EP","https://worldwide.espacenet.com/publicationDetails/citedDocuments?CC=US&NR=2019223656A1&KC=A1&FT=D&ND=3&date=20190725&DB=&locale=fr_EP","https://worldwide.espacenet.com/publicationDetails/citingDocuments?CC=US&NR=2019223656A1&KC=A1&FT=D&ND=3&date=20190725&DB=&locale=fr_EP","https://worldwide.espacenet.com/publicationDetails/inpadoc?CC=US&NR=2019223656A1&KC=A1&FT=D&ND=3&date=20190725&DB=&locale=fr_EP","https://worldwide.espacenet.com/publicationDetails/inpadocPatentFamily?CC=US&NR=2019223656A1&KC=A1&FT=D&ND=3&date=20190725&DB=&locale=fr_EP","31043","3988","1","10"
"20","EP3399892 (A1)","EP3399892A1","BEVERAGE MACHINE WITH A CONFIGURATION FOR SAFE STANDING","2018-11-14","2016-01-08","THULIEZ JEAN-LUC [CH]; KILPATRICK KEVIN [US]; RYUTARO TAKAYAMA STEVEN [US]; OBLIGER NICOLAS [FR]; BRANKO LUKIC [US]; CROZIER ETIENNE [CH]; GUYON BERTRAND [FR]; MAGATTI MARCO [CH]","(BRANKO, Lukic; CROZIER, Etienne; GUYON, Bertrand; KILPATRICK, Kevin; MAGATTI, Marco; OBLIGER, Nicolas; RYUTARO TAKAYAMA, Steven; THULIEZ, Jean-Luc; BRANKO, Lukic; CROZIER, Etienne; GUYON, Bertrand; KILPATRICK, Kevin; MAGATTI, Marco; OBLIGER, Nicolas; RYUTARO TAKAYAMA, Steven; THULIEZ, Jean-Luc)","NESTEC SA [CH]; NESTLE SA [CH]","(Nestec S.A.; Société des Produits Nestlé S.A.)","Numéro de demande EP20170700202 20170106 Dossier global","Numéro(s) de priorité: WO2016US12670 20160108 ; WO2017EP50239 20170106 ;","Également publié en tant que: EP3399892 (A1) EP3399892 (B1) WO2017118715 (A1) EP3399892 (A1) EP3399892 (B1) WO2017118715 (A1) moins","Classification: - internationale A47J31/44 - coopérative A47J31/4407 (EP)","","https://worldwide.espacenet.com/publicationDetails/biblio?II=19&ND=3&adjacent=true&locale=fr_EP&FT=D&date=20181114&CC=EP&NR=3399892A1&KC=A1","https://worldwide.espacenet.com/publicationDetails/description?CC=EP&NR=3399892A1&KC=A1&FT=D&ND=3&date=20181114&DB=&locale=fr_EP","https://worldwide.espacenet.com/publicationDetails/claims?CC=EP&NR=3399892A1&KC=A1&FT=D&ND=3&date=20181114&DB=&locale=fr_EP","https://worldwide.espacenet.com/publicationDetails/mosaics?CC=EP&NR=3399892A1&KC=A1&FT=D&ND=3&date=20181114&DB=&locale=fr_EP","https://worldwide.espacenet.com/publicationDetails/originalDocument?CC=EP&NR=3399892A1&KC=A1&FT=D&ND=3&date=20181114&DB=&locale=fr_EP","https://worldwide.espacenet.com/publicationDetails/citedDocuments?CC=EP&NR=3399892A1&KC=A1&FT=D&ND=3&date=20181114&DB=&locale=fr_EP","https://worldwide.espacenet.com/publicationDetails/citingDocuments?CC=EP&NR=3399892A1&KC=A1&FT=D&ND=3&date=20181114&DB=&locale=fr_EP","https://worldwide.espacenet.com/publicationDetails/inpadoc?CC=EP&NR=3399892A1&KC=A1&FT=D&ND=3&date=20181114&DB=&locale=fr_EP","https://worldwide.espacenet.com/publicationDetails/inpadocPatentFamily?CC=EP&NR=3399892A1&KC=A1&FT=D&ND=3&date=20181114&DB=&locale=fr_EP","32817","10961","1","30"
"21","US2019008312 (A1)","US2019008312A1","Beverage machine with an ergonomic water storage","2019-01-10","2016-01-08","THULIEZ JEAN-LUC [CH]; KILPATRICK KEVIN [US]; RYUTARO TAKAYAMA STEVEN [US]; OBLIGER NICOLAS [FR]; BRANKO LUKIC [US]; CROZIER ETIENNE [CH]; GUYON BERTRAND [FR]; MAGATTI MARCO [CH]","(Branko, Lukic; Crozier, Etienne; Guyon, Bertrand; Kilpatrick, Kevin; Magatti, Marco; Obliger, Nicolas; Ryutaro Takayama, Steven; Thuliez, Jean-Luc; Branko, Lukic; Crozier, Etienne; Guyon, Bertrand; Kilpatrick, Kevin; Magatti, Marco; Obliger, Nicolas; Ryutaro Takayama, Steven; Thuliez, Jean-Luc)","NESTEC SA [CH]; NESTLE SA [CH]","(NESTEC S.A.; NESTEC S.A.; Societe des Produits Nestle S.A.)","Numéro de demande US201716067349 20170106 Dossier global","Numéro(s) de priorité: WO2016US12647 20160108 ; WO2017EP50237 20170106 ;","Également publié en tant que: AU2017205277 (A1) CA3010682 (A1) CN108471899 (A) CN108471899 (B) EP3399890 (A1) plus AU2017205277 (A1) CA3010682 (A1) CN108471899 (A) CN108471899 (B) EP3399890 (A1) JP2019505286 (A) RU2018128741 (A) US10945552 (B2) WO2017118713 (A1) moins","Classification: - internationale A47J31/00; A47J31/36; A47J31/44 - coopérative A47J31/005 (US); A47J31/3676 (EP, US); A47J31/4403 (EP, US)","A machine (1) for preparing a beverage has: a body (1′) with a fluid line (1″,1′″) extending from a liquid inlet (1″) to a beverage outlet (1′″); a liquid tank (15) that has an outlet (16) connected to the liquid inlet (1″); and a carrier (11,12) assembled to the body (1′) for carrying the liquid tank (15). The carrier (11,12) is movable with the liquid tank (15) as a unit (10) inwards into the body (1′) into an operative position for supplying liquid to the liquid inlet (1″) and outwards from the body (1′) into a service position.","https://worldwide.espacenet.com/publicationDetails/biblio?II=20&ND=3&adjacent=true&locale=fr_EP&FT=D&date=20190110&CC=US&NR=2019008312A1&KC=A1","https://worldwide.espacenet.com/publicationDetails/description?CC=US&NR=2019008312A1&KC=A1&FT=D&ND=3&date=20190110&DB=&locale=fr_EP","https://worldwide.espacenet.com/publicationDetails/claims?CC=US&NR=2019008312A1&KC=A1&FT=D&ND=3&date=20190110&DB=&locale=fr_EP","https://worldwide.espacenet.com/publicationDetails/mosaics?CC=US&NR=2019008312A1&KC=A1&FT=D&ND=3&date=20190110&DB=&locale=fr_EP","https://worldwide.espacenet.com/publicationDetails/originalDocument?CC=US&NR=2019008312A1&KC=A1&FT=D&ND=3&date=20190110&DB=&locale=fr_EP","https://worldwide.espacenet.com/publicationDetails/citedDocuments?CC=US&NR=2019008312A1&KC=A1&FT=D&ND=3&date=20190110&DB=&locale=fr_EP","https://worldwide.espacenet.com/publicationDetails/citingDocuments?CC=US&NR=2019008312A1&KC=A1&FT=D&ND=3&date=20190110&DB=&locale=fr_EP","https://worldwide.espacenet.com/publicationDetails/inpadoc?CC=US&NR=2019008312A1&KC=A1&FT=D&ND=3&date=20190110&DB=&locale=fr_EP","https://worldwide.espacenet.com/publicationDetails/inpadocPatentFamily?CC=US&NR=2019008312A1&KC=A1&FT=D&ND=3&date=20190110&DB=&locale=fr_EP","35603","3288","1","11"
"22","EP3399891 (A1)","EP3399891A1","INFILTRATION-SAFE BEVERAGE MACHINE","2018-11-14","2016-01-08","THULIEZ JEAN-LUC [CH]; KILPATRICK KEVIN [US]; RYUTARO TAKAYAMA STEVEN [US]; OBLIGER NICOLAS [FR]; BRANKO LUKIC [US]; CROZIER ETIENNE [CH]; GUYON BERTRAND [FR]; MAGATTI MARCO [CH]","(BRANKO, Lukic; CROZIER, Etienne; GUYON, Bertrand; KILPATRICK, Kevin; MAGATTI, Marco; OBLIGER, Nicolas; RYUTARO TAKAYAMA, Steven; THULIEZ, Jean-Luc; BRANKO, Lukic; CROZIER, Etienne; GUYON, Bertrand; KILPATRICK, Kevin; MAGATTI, Marco; OBLIGER, Nicolas; RYUTARO TAKAYAMA, Steven; THULIEZ, Jean-Luc)","NESTEC SA [CH]; NESTLE SA [CH]","(Nestec S.A.; Société des Produits Nestlé S.A.)","Numéro de demande EP20170700125 20170106 Dossier global","Numéro(s) de priorité: WO2016US12630 20160108 ; WO2017EP50238 20170106 ;","Également publié en tant que: EP3399891 (A1) EP3399891 (B1) WO2017118714 (A1) EP3399891 (A1) EP3399891 (B1) WO2017118714 (A1) moins","Classification: - internationale A47J31/44 - coopérative A47J31/4407 (EP)","","https://worldwide.espacenet.com/publicationDetails/biblio?II=21&ND=3&adjacent=true&locale=fr_EP&FT=D&date=20181114&CC=EP&NR=3399891A1&KC=A1","https://worldwide.espacenet.com/publicationDetails/description?CC=EP&NR=3399891A1&KC=A1&FT=D&ND=3&date=20181114&DB=&locale=fr_EP","https://worldwide.espacenet.com/publicationDetails/claims?CC=EP&NR=3399891A1&KC=A1&FT=D&ND=3&date=20181114&DB=&locale=fr_EP","https://worldwide.espacenet.com/publicationDetails/mosaics?CC=EP&NR=3399891A1&KC=A1&FT=D&ND=3&date=20181114&DB=&locale=fr_EP","https://worldwide.espacenet.com/publicationDetails/originalDocument?CC=EP&NR=3399891A1&KC=A1&FT=D&ND=3&date=20181114&DB=&locale=fr_EP","https://worldwide.espacenet.com/publicationDetails/citedDocuments?CC=EP&NR=3399891A1&KC=A1&FT=D&ND=3&date=20181114&DB=&locale=fr_EP","https://worldwide.espacenet.com/publicationDetails/citingDocuments?CC=EP&NR=3399891A1&KC=A1&FT=D&ND=3&date=20181114&DB=&locale=fr_EP","https://worldwide.espacenet.com/publicationDetails/inpadoc?CC=EP&NR=3399891A1&KC=A1&FT=D&ND=3&date=20181114&DB=&locale=fr_EP","https://worldwide.espacenet.com/publicationDetails/inpadocPatentFamily?CC=EP&NR=3399891A1&KC=A1&FT=D&ND=3&date=20181114&DB=&locale=fr_EP","35407","11073","1","30"
"23","EP3393889 (A1)","EP3393889A1","VEHICLE ARCHITECTURE","2018-10-31","2015-12-24","THULIEZ JEAN-LUC [CH]; CROZIER ETIENNE [CH]","(THULIEZ, Jean-Luc; CROZIER, Etienne; THULIEZ, Jean-Luc; CROZIER, Etienne)","SOFTCAR SA [CH]","(Softcar SA; Softcar SA)","Numéro de demande EP20160834045 20161221 Dossier global","Numéro(s) de priorité: WO2015IB59980 20151224 ; WO2016IB57888 20161221 ;","Également publié en tant que: EP3393889 (A1) EP3393889 (B1) DK3393889 (T3) ES2932802 (T3) HUE060564 (T2) plus EP3393889 (A1) EP3393889 (B1) DK3393889 (T3) ES2932802 (T3) HUE060564 (T2) MA44155 (A) MA44155 (B1) PL3393889 (T3) PT3393889 (T) WO2017109726 (A1) moins","Classification: - internationale B62D21/16; B62D29/04; B62D31/00; B62D63/02 - coopérative B62D21/16 (EP); B62D29/043 (EP); B62D31/003 (EP); B62D63/025 (EP)","","https://worldwide.espacenet.com/publicationDetails/biblio?II=22&ND=3&adjacent=true&locale=fr_EP&FT=D&date=20181031&CC=EP&NR=3393889A1&KC=A1","https://worldwide.espacenet.com/publicationDetails/description?CC=EP&NR=3393889A1&KC=A1&FT=D&ND=3&date=20181031&DB=&locale=fr_EP","https://worldwide.espacenet.com/publicationDetails/claims?CC=EP&NR=3393889A1&KC=A1&FT=D&ND=3&date=20181031&DB=&locale=fr_EP","https://worldwide.espacenet.com/publicationDetails/mosaics?CC=EP&NR=3393889A1&KC=A1&FT=D&ND=3&date=20181031&DB=&locale=fr_EP","https://worldwide.espacenet.com/publicationDetails/originalDocument?CC=EP&NR=3393889A1&KC=A1&FT=D&ND=3&date=20181031&DB=&locale=fr_EP","https://worldwide.espacenet.com/publicationDetails/citedDocuments?CC=EP&NR=3393889A1&KC=A1&FT=D&ND=3&date=20181031&DB=&locale=fr_EP","https://worldwide.espacenet.com/publicationDetails/citingDocuments?CC=EP&NR=3393889A1&KC=A1&FT=D&ND=3&date=20181031&DB=&locale=fr_EP","https://worldwide.espacenet.com/publicationDetails/inpadoc?CC=EP&NR=3393889A1&KC=A1&FT=D&ND=3&date=20181031&DB=&locale=fr_EP","https://worldwide.espacenet.com/publicationDetails/inpadocPatentFamily?CC=EP&NR=3393889A1&KC=A1&FT=D&ND=3&date=20181031&DB=&locale=fr_EP","35518","4733","3","47"
"24","US2019059639 (A1)","US2019059639A1","Beverage machine with ergonomic outlet","2019-02-28","2015-09-04","THULIEZ JEAN-LUC [CH]; RYUTARO TAKAYAMA STEVEN [US]; OBLIGER NICOLAS [FR]; BRANKO LUKIC [US]; CROZIER ETIENNE [CH]; GUYON BERTRAND [FR]","(Branko, Lukic; Crozier, Etienne; Guyon, Bertrand; Obliger, Nicolas; Ryutaro Takayama, Steven; Thuliez, Jean-Luc; Branko, Lukic; Crozier, Etienne; Guyon, Bertrand; Obliger, Nicolas; Ryutaro Takayama, Steven; Thuliez, Jean-Luc)","NECTEC S A [CH]; NESTEC SA [CH]; NESTLE SA [CH]","(NECTEC S.A.; NESTEC S.A.; Societe des Produits Nestle S.A.)","Numéro de demande US201615757031 20160902 Dossier global","Numéro(s) de priorité: WO2015US48691 20150904 ; WO2016EP70680 20160902 ;","Également publié en tant que: AU2016316786 (A1) AU2016316786 (B2) BR112018002158 (A2) CA2995147 (A1) CA2995147 (C) plus AU2016316786 (A1) AU2016316786 (B2) BR112018002158 (A2) CA2995147 (A1) CA2995147 (C) CN107920684 (A) CN107920684 (B) EP3344099 (A1) EP3344099 (B1) ES2762975 (T3) JP2018526084 (A) JP6998299 (B2) PT3344099 (T) RU2018111720 (A) RU2018111720 (A3) RU2721090 (C2) US10849456 (B2) WO2017037212 (A1) moins","Classification: - internationale A47J31/40; A47J31/44; A47J31/46; A47J31/52 - coopérative A47J31/407 (US); A47J31/4403 (EP, RU, US); A47J31/4407 (EP, US); A47J31/46 (EP, RU, US); A47J31/52 (US); A47J31/525 (EP); A47J31/5255 (EP);","[0001] A machine (1) for preparing and dispensing a beverage (2) comprises: —a main body (10) containing a unit (11,12,13,14,15) for preparing said beverage (2) to be dispensed via an outlet (21) to an external user-recipient (3) at a user-recipient placement location (30); —a beverage dispensing head (20) that includes the outlet (21) and that is movable relative to the main body (10) inwards into the main body (10) into a retracted head position and outwards from the main body (10) into a deployed head position; and —a control unit (16) for controlling the preparation unit (11,12,13,14,15) to supply said beverage (2) to the outlet (21). The control unit (16) is configured to: —maintain or leave the beverage dispensing head (20) in its retracted position when the beverage preparation unit (11,12,13,14,15) is not operated to process a liquid; and/or —move the beverage dispensing head (20) into its deployed position or maintain or leave it in this position only when the control unit (16) operates the preparation unit (11,12,13,14,15) to process a liquid for dispensing via the outlet (21).","https://worldwide.espacenet.com/publicationDetails/biblio?II=23&ND=3&adjacent=true&locale=fr_EP&FT=D&date=20190228&CC=US&NR=2019059639A1&KC=A1","https://worldwide.espacenet.com/publicationDetails/description?CC=US&NR=2019059639A1&KC=A1&FT=D&ND=3&date=20190228&DB=&locale=fr_EP","https://worldwide.espacenet.com/publicationDetails/claims?CC=US&NR=2019059639A1&KC=A1&FT=D&ND=3&date=20190228&DB=&locale=fr_EP","https://worldwide.espacenet.com/publicationDetails/mosaics?CC=US&NR=2019059639A1&KC=A1&FT=D&ND=3&date=20190228&DB=&locale=fr_EP","https://worldwide.espacenet.com/publicationDetails/originalDocument?CC=US&NR=2019059639A1&KC=A1&FT=D&ND=3&date=20190228&DB=&locale=fr_EP","https://worldwide.espacenet.com/publicationDetails/citedDocuments?CC=US&NR=2019059639A1&KC=A1&FT=D&ND=3&date=20190228&DB=&locale=fr_EP","https://worldwide.espacenet.com/publicationDetails/citingDocuments?CC=US&NR=2019059639A1&KC=A1&FT=D&ND=3&date=20190228&DB=&locale=fr_EP","https://worldwide.espacenet.com/publicationDetails/inpadoc?CC=US&NR=2019059639A1&KC=A1&FT=D&ND=3&date=20190228&DB=&locale=fr_EP","https://worldwide.espacenet.com/publicationDetails/inpadocPatentFamily?CC=US&NR=2019059639A1&KC=A1&FT=D&ND=3&date=20190228&DB=&locale=fr_EP","44050","6144","1","12"
"25","US2019313839 (A1)","US2019313839A1","Beverage machine with an ergonomic user-interface","2019-10-17","2015-09-04","THULIEZ JEAN-LUC [CH]; RYUTARO TAKAYAMA STEVEN [US]; OBLIGER NICOLAS [FR]; BRANKO LUKIC [US]; CROZIER ETIENNE [CH]; GUYON BERTRAND [FR]; GUYON BETRAND [FR]","(Branko, Lukic; Crozier, Etienne; Guyon, Betrand; Obliger, Nicolas; Ryutaro Takayama, Steven; Thuliez, Jean-Luc; Branko, Lukic; Crozier, Etienne; Guyon, Bertrand; Obliger, Nicolas; Ryutaro Takayama, Steven; Thuliez, Jean-Luc)","NESTEC SA [CH]; NESTLE SA [CH]","(NESTEC S.A; NESTEC S.A.; Societe des Produits Nestle S.A.)","Numéro de demande US201615757029 20160902 Dossier global","Numéro(s) de priorité: WO2015US48693 20150904 ; WO2016EP70685 20160902 ;","Également publié en tant que: AU2016316787 (A1) AU2016316787 (B2) CA2995152 (A1) CN108024656 (A) CN108024656 (B) plus AU2016316787 (A1) AU2016316787 (B2) CA2995152 (A1) CN108024656 (A) CN108024656 (B) EP3344098 (A1) EP3344098 (B1) ES2737825 (T3) JP2018526085 (A) JP6910344 (B2) PT3344098 (T) RU2018111742 (A) RU2018111742 (A3) RU2720564 (C2) US11116355 (B2) WO2017037215 (A1) moins","Classification: - internationale A47J31/36; A47J31/44; A47J31/46; A47J31/52 - coopérative A47J31/3633 (US); A47J31/4403 (EP, RU, US); A47J31/4407 (EP); A47J31/46 (RU, US); A47J31/52 (US); A47J31/5255 (EP); Y02W90/10 (EP)","A machine (1) for preparing and dispensing a beverage (2) comprises: —a main body (10) containing a unit (11, 12, 13, 14, 15) for preparing said beverage (2) to be dispensed via an outlet (21) to an external user-recipient (3) at a user-recipient placement location (30);—an auxiliary body (20) that is movable relative to the main body (10) inwards into the main body (10) into a retracted position and outwards from the main body (10) into a deployed position;—a control unit (16) for controlling the preparation unit (11, 12, 13, 14, 15) to supply said beverage (2) to the outlet (21); and—a user-interlace (17, 17′) connected to the control unit (16). The user-interface (17, 17′) is located on the auxiliary body (20) and is movable therewith.","https://worldwide.espacenet.com/publicationDetails/biblio?II=24&ND=3&adjacent=true&locale=fr_EP&FT=D&date=20191017&CC=US&NR=2019313839A1&KC=A1","https://worldwide.espacenet.com/publicationDetails/description?CC=US&NR=2019313839A1&KC=A1&FT=D&ND=3&date=20191017&DB=&locale=fr_EP","https://worldwide.espacenet.com/publicationDetails/claims?CC=US&NR=2019313839A1&KC=A1&FT=D&ND=3&date=20191017&DB=&locale=fr_EP","https://worldwide.espacenet.com/publicationDetails/mosaics?CC=US&NR=2019313839A1&KC=A1&FT=D&ND=3&date=20191017&DB=&locale=fr_EP","https://worldwide.espacenet.com/publicationDetails/originalDocument?CC=US&NR=2019313839A1&KC=A1&FT=D&ND=3&date=20191017&DB=&locale=fr_EP","https://worldwide.espacenet.com/publicationDetails/citedDocuments?CC=US&NR=2019313839A1&KC=A1&FT=D&ND=3&date=20191017&DB=&locale=fr_EP","https://worldwide.espacenet.com/publicationDetails/citingDocuments?CC=US&NR=2019313839A1&KC=A1&FT=D&ND=3&date=20191017&DB=&locale=fr_EP","https://worldwide.espacenet.com/publicationDetails/inpadoc?CC=US&NR=2019313839A1&KC=A1&FT=D&ND=3&date=20191017&DB=&locale=fr_EP","https://worldwide.espacenet.com/publicationDetails/inpadocPatentFamily?CC=US&NR=2019313839A1&KC=A1&FT=D&ND=3&date=20191017&DB=&locale=fr_EP","46136","4996","1","12"
"26","EP3261867 (A2)","EP3261867A2","ELECTRIC SINGLE-SEATER VEHICLE","2018-01-03","2015-02-28","THULIEZ JEAN-LUC [CH]; HEISEL GUILLAUME [CH]; ROMAND DAMIEN [CH]; OBLIGER NICOLAS [FR]; CROZIER ETIENNE [CH]","(THULIEZ, Jean-Luc; CROZIER, Etienne; OBLIGER, Nicolas; HEISEL, Guillaume; ROMAND, Damien; THULIEZ, Jean-Luc; CROZIER, Etienne; OBLIGER, Nicolas; HEISEL, Guillaume; ROMAND, Damien)","AVENTOR SA [CH]","(Aventor SA; Aventor SA)","Numéro de demande EP20160715092 20160226 Dossier global","Numéro(s) de priorité: WO2015IB51486 20150228 ; WO2016IB51070 20160226 ;","Également publié en tant que: EP3261867 (A2) EP3261867 (B1) WO2016135691 (A2) WO2016135691 (A3) EP3261867 (A2) EP3261867 (B1) WO2016135691 (A2) WO2016135691 (A3) moins","Classification: - internationale B60K1/04; B62D23/00; B62D29/04; B62D61/06 - coopérative B60K1/04 (EP, US); B60K2001/0438 (EP); B60K2001/0494 (EP); B62D23/005 (EP); B62D24/00 (EP); B62D29/005 (EP); B62D61/065 (EP)","","https://worldwide.espacenet.com/publicationDetails/biblio?II=25&ND=3&adjacent=true&locale=fr_EP&FT=D&date=20180103&CC=EP&NR=3261867A2&KC=A2","https://worldwide.espacenet.com/publicationDetails/description?CC=EP&NR=3261867A2&KC=A2&FT=D&ND=3&date=20180103&DB=&locale=fr_EP","https://worldwide.espacenet.com/publicationDetails/claims?CC=EP&NR=3261867A2&KC=A2&FT=D&ND=3&date=20180103&DB=&locale=fr_EP","https://worldwide.espacenet.com/publicationDetails/mosaics?CC=EP&NR=3261867A2&KC=A2&FT=D&ND=3&date=20180103&DB=&locale=fr_EP","https://worldwide.espacenet.com/publicationDetails/originalDocument?CC=EP&NR=3261867A2&KC=A2&FT=D&ND=3&date=20180103&DB=&locale=fr_EP","https://worldwide.espacenet.com/publicationDetails/citedDocuments?CC=EP&NR=3261867A2&KC=A2&FT=D&ND=3&date=20180103&DB=&locale=fr_EP","https://worldwide.espacenet.com/publicationDetails/citingDocuments?CC=EP&NR=3261867A2&KC=A2&FT=D&ND=3&date=20180103&DB=&locale=fr_EP","https://worldwide.espacenet.com/publicationDetails/inpadoc?CC=EP&NR=3261867A2&KC=A2&FT=D&ND=3&date=20180103&DB=&locale=fr_EP","https://worldwide.espacenet.com/publicationDetails/inpadocPatentFamily?CC=EP&NR=3261867A2&KC=A2&FT=D&ND=3&date=20180103&DB=&locale=fr_EP","30899","4302","3","35"
"27","EP3215454 (A1)","EP3215454A1","BEAKER THAT CAN BE FILLED FROM THE BOTTOM AND CONNECTING DEVICE FOR THE BEAKER","2017-09-13","2014-11-07","THULIEZ JEAN-LUC [CH]; EL ALEJ ALI [CH]; CROZIER ETIENNE [CH]","(EL ALEJ, Ali; CROZIER, Etienne; THULIEZ, Jean-luc; EL ALEJ, Ali; CROZIER, Etienne; THULIEZ, Jean-luc; EL ALEJ, Ali; CROZIER, Etienne; THULIEZ, Jean-luc)","IP EVOLUTION SA [CH]","(IP Evolution SA; IP Evolution SA; IP Evolution SA)","Numéro de demande EP20150798236 20151106 Effet unitaire Dossier global","Numéro(s) de priorité: CH20140001726 20141107 ; WO2015IB58589 20151106 ;","Également publié en tant que: EP3215454 (A1) EP3215454 (B1) EP3215454 (C0) CH710343 (A1) WO2016071880 (A1) EP3215454 (A1) EP3215454 (B1) EP3215454 (C0) CH710343 (A1) WO2016071880 (A1) moins","Classification: - internationale A47G19/22; B67D1/04; B67D1/06 - coopérative A47G19/2205 (EP); B67D1/04 (EP); B67D1/06 (EP); B67D1/1272 (EP); B67D2210/00065 (EP)","","https://worldwide.espacenet.com/publicationDetails/biblio?II=26&ND=3&adjacent=true&locale=fr_EP&FT=D&date=20170913&CC=EP&NR=3215454A1&KC=A1","https://worldwide.espacenet.com/publicationDetails/description?CC=EP&NR=3215454A1&KC=A1&FT=D&ND=3&date=20170913&DB=&locale=fr_EP","https://worldwide.espacenet.com/publicationDetails/claims?CC=EP&NR=3215454A1&KC=A1&FT=D&ND=3&date=20170913&DB=&locale=fr_EP","https://worldwide.espacenet.com/publicationDetails/mosaics?CC=EP&NR=3215454A1&KC=A1&FT=D&ND=3&date=20170913&DB=&locale=fr_EP","https://worldwide.espacenet.com/publicationDetails/originalDocument?CC=EP&NR=3215454A1&KC=A1&FT=D&ND=3&date=20170913&DB=&locale=fr_EP","https://worldwide.espacenet.com/publicationDetails/citedDocuments?CC=EP&NR=3215454A1&KC=A1&FT=D&ND=3&date=20170913&DB=&locale=fr_EP","https://worldwide.espacenet.com/publicationDetails/citingDocuments?CC=EP&NR=3215454A1&KC=A1&FT=D&ND=3&date=20170913&DB=&locale=fr_EP","https://worldwide.espacenet.com/publicationDetails/inpadoc?CC=EP&NR=3215454A1&KC=A1&FT=D&ND=3&date=20170913&DB=&locale=fr_EP","https://worldwide.espacenet.com/publicationDetails/inpadocPatentFamily?CC=EP&NR=3215454A1&KC=A1&FT=D&ND=3&date=20170913&DB=&locale=fr_EP","32008","3769","1","32"
