"idx","publication","doc_id","title","publication_date","priority_date","inventors","secondary_inventors","applicants","secondary_applicants","application_number","priority_numbers","also_published_as","classification","abstract","biblio_link","description_link","claims_link","mosaics_link","original_document_link","cited_documents_link","citing_documents_link","legal_status_link","inpadoc_family_link","description_length_exact","claims_length_exact","mosaic_pages","original_pages"
"36","FR2999439 (A1)","FR2999439A1","DISPOSITIF DE DISTRIBUTION D'UN PRODUIT ET D'EMISSION D'UN RAYONNEMENT LUMINEUX","2014-06-20","2012-12-15","HEISEL GUILLAUME [CH]; CROZIER ETIENNE [CH]; DECAUX STEPHANE [FR]; THULIEZ JEAN LUC [CH]","(THULIEZ JEAN LUC; CROZIER ETIENNE; HEISEL GUILLAUME; DECAUX STEPHANE; THULIEZ, JEAN LUC; CROZIER, ETIENNE; HEISEL, GUILLAUME; DECAUX, STEPHANE)","DECAUX GERALDINE [FR]; SIMON FLORENT [FR]; DECAUX STEPHANE [FR]","(DECAUX STEPHANE; DECAUX GERALDINE; SIMON FLORENT; DECAUX STEPHANE; DECAUX GERALDINE; SIMON FLORENT)","Numéro de demande FR20120003445 20121217","Numéro(s) de priorité: FR20120003433 20121215 ; FR20120003445 20121217 ;","Également publié en tant que: FR2999439 (A1) FR2999439 (B1) AU2013357240 (A1) AU2013357240 (B2) BR112015014032 (A2) plus FR2999439 (A1) FR2999439 (B1) AU2013357240 (A1) AU2013357240 (B2) BR112015014032 (A2) BR112015014032 (B1) CA2895145 (A1) CA2895145 (C) CN104994902 (A) CN104994902 (B) CN113877052 (A) CN113877052 (B) EP2931355 (A1) EP2931355 (B1) ES2755037 (T3) FR2999438 (A1) FR2999438 (B1) HK1212640 (A1) JP2015536776 (A) JP2019080941 (A) JP6829543 (B2) KR102332094 (B1) KR20150112950 (A) MX2015007620 (A) MX375130 (B) RU2015128624 (A) RU2672800 (C2) US10334933 (B2) US2015327653 (A1) WO2014091035 (A1) moins","Classification: - internationale A61H15/02; A61M31/00; A61M35/00 - coopérative A45D2200/055 (EP, US); A45D34/041 (EP, US); A45D40/261 (US); A61H15/0092 (EP, US); A61H15/02 (EP, US); A61H2015/0064 (EP, US); A61H2201/0184 (EP, US); A61H2201/10 (EP, US); A61H2201/105 (EP, US); A61H2201/1246 (EP, US); A61H7/003 (EP, US); A61M2037/0007 (EP, US); A61M35/003 (EP, US); A61N2005/063 (EP, US); A61N2005/0631 (EP, US); A61N2005/0644 (EP, US); A61N2005/0659 (EP, US); A61N5/06 (RU); A61N5/0616 (EP, US)","Il s'agit de distribuer un produit (3) contenant un composé actif sur une surface (5) d'un corps vivant et d'illuminer cette surface. Le dispositif présente pour cela une zone (30) de distribution du produit vers ladite surface et une source lumineuse (9) émettant au moins un rayon vers la surface.","https://worldwide.espacenet.com/publicationDetails/biblio?II=35&ND=3&adjacent=true&locale=fr_EP&FT=D&date=20140620&CC=FR&NR=2999439A1&KC=A1","https://worldwide.espacenet.com/publicationDetails/description?CC=FR&NR=2999439A1&KC=A1&FT=D&ND=3&date=20140620&DB=&locale=fr_EP","https://worldwide.espacenet.com/publicationDetails/claims?CC=FR&NR=2999439A1&KC=A1&FT=D&ND=3&date=20140620&DB=&locale=fr_EP","https://worldwide.espacenet.com/publicationDetails/mosaics?CC=FR&NR=2999439A1&KC=A1&FT=D&ND=3&date=20140620&DB=&locale=fr_EP","https://worldwide.espacenet.com/publicationDetails/originalDocument?CC=FR&NR=2999439A1&KC=A1&FT=D&ND=3&date=20140620&DB=&locale=fr_EP","https://worldwide.espacenet.com/publicationDetails/citedDocuments?CC=FR&NR=2999439A1&KC=A1&FT=D&ND=3&date=20140620&DB=&locale=fr_EP","https://worldwide.espacenet.com/publicationDetails/citingDocuments?CC=FR&NR=2999439A1&KC=A1&FT=D&ND=3&date=20140620&DB=&locale=fr_EP","https://worldwide.espacenet.com/publicationDetails/inpadoc?CC=FR&NR=2999439A1&KC=A1&FT=D&ND=3&date=20140620&DB=&locale=fr_EP","https://worldwide.espacenet.com/publicationDetails/inpadocPatentFamily?CC=FR&NR=2999439A1&KC=A1&FT=D&ND=3&date=20140620&DB=&locale=fr_EP","38109","4864","2","30"
"37","CH700288 (A2)","CH700288A2","Automatic hot beverage preparing machine i.e. coffee machine, has discharge device used for unlocking and opening extraction chamber, swinging pivoting support and ejecting used portion into recovery tray immediately after extraction","2010-07-30","2009-01-28","THULIEZ JEAN-LUC [CH]; CROZIER ETIENNE [CH]","(ETIENNE CROZIER; JEAN-LUC THULIEZ)","SEMEUSE MARC A BLOCH [CH]","(LA SEMEUSE MARC A. BLOCH)","Numéro de demande CH20090000124 20090128","Numéro(s) de priorité: CH20090000124 20090128 ;","Également publié en tant que: CH700288 (A2) CH700288 (A2) moins","Classification: - internationale A47J31/44 - coopérative A47J31/3638 (EP); A47J31/368 (EP)","The machine (10) has a container to receive a portion (20) containing a determined dosage of substance e.g. roasted and ground coffee, partially soluble in water. Heating unit heats a preset quantity of water in a reservoir. An electric motor is coupled to an automatic discharge device of the portion after the utilization of machine. The device is used for unlocking and opening an extraction chamber that contains a rotating support (21) carrying the portion, swinging the support and ejecting the used portion into a recovery tray (14) immediately after extraction, without user intervention.","https://worldwide.espacenet.com/publicationDetails/biblio?II=36&ND=3&adjacent=true&locale=fr_EP&FT=D&date=20100730&CC=CH&NR=700288A2&KC=A2","https://worldwide.espacenet.com/publicationDetails/description?CC=CH&NR=700288A2&KC=A2&FT=D&ND=3&date=20100730&DB=&locale=fr_EP","https://worldwide.espacenet.com/publicationDetails/claims?CC=CH&NR=700288A2&KC=A2&FT=D&ND=3&date=20100730&DB=&locale=fr_EP","https://worldwide.espacenet.com/publicationDetails/mosaics?CC=CH&NR=700288A2&KC=A2&FT=D&ND=3&date=20100730&DB=&locale=fr_EP","https://worldwide.espacenet.com/publicationDetails/originalDocument?CC=CH&NR=700288A2&KC=A2&FT=D&ND=3&date=20100730&DB=&locale=fr_EP","https://worldwide.espacenet.com/publicationDetails/citedDocuments?CC=CH&NR=700288A2&KC=A2&FT=D&ND=3&date=20100730&DB=&locale=fr_EP","https://worldwide.espacenet.com/publicationDetails/citingDocuments?CC=CH&NR=700288A2&KC=A2&FT=D&ND=3&date=20100730&DB=&locale=fr_EP","https://worldwide.espacenet.com/publicationDetails/inpadoc?CC=CH&NR=700288A2&KC=A2&FT=D&ND=3&date=20100730&DB=&locale=fr_EP","https://worldwide.espacenet.com/publicationDetails/inpadocPatentFamily?CC=CH&NR=700288A2&KC=A2&FT=D&ND=3&date=20100730&DB=&locale=fr_EP","24887","5538","2","16"
"38","US2011081464 (A1)","US2011081464A1","DEVICE AND METHOD FOR PRODUCING A FROTHED WHITENED BEVERAGE","2011-04-07","2008-05-28","THULIEZ JEAN-LUC [CH]; GUGERLI RAPHAEL [CH]","(GUGERLI RAPHAEL; THULIEZ JEAN-LUC; GUGERLI RAPHAEL; THULIEZ JEAN-LUC)","THULIEZ JEAN-LUC [CH]; NESTEC SA [CH]; GUGERLI RAPHAEL [CH]","(NESTEC S.A.; NESTEC S.A.; GUGERLI RAPHAEL; THULIEZ JEAN-LUC)","Numéro de demande US20090994532 20090526 Dossier global","Numéro(s) de priorité: EP20080157056 20080528 ; WO2009EP56368 20090526 ;","Également publié en tant que: EP2127567 (A1) EP2303076 (A1) EP2303076 (B1) MX2010012978 (A) US8383184 (B2) plus EP2127567 (A1) EP2303076 (A1) EP2303076 (B1) MX2010012978 (A) US8383184 (B2) WO2009144219 (A1) moins","Classification: - internationale A23P30/40; A47J31/00; A47J31/41 - coopérative A47J31/401 (EP, US)","The invention concerns a method for hygienically and automatically producing from a beverage dispensing device a frothed whitened beverage in a receptacle comprising upon the actuation of a command on the device the following operations controlled by a control unit of said device: -a. metering and delivering a pre-warming volume of heated water in a receptacle for prewarming a whitening food component already contained in the receptacle and forming a warmed liquid in said receptacle, -b. metering and delivering a frothing volume of heated water in the form of at least a pressurized jet directed toward the receptacle for frothing the warmed liquid, -c. producing and delivering in the receptacle a liquid mixture made of a second food component and a metered mixing volume of water. The invention also concerns a device for implementing said method.","https://worldwide.espacenet.com/publicationDetails/biblio?II=37&ND=3&adjacent=true&locale=fr_EP&FT=D&date=20110407&CC=US&NR=2011081464A1&KC=A1","https://worldwide.espacenet.com/publicationDetails/description?CC=US&NR=2011081464A1&KC=A1&FT=D&ND=3&date=20110407&DB=&locale=fr_EP","https://worldwide.espacenet.com/publicationDetails/claims?CC=US&NR=2011081464A1&KC=A1&FT=D&ND=3&date=20110407&DB=&locale=fr_EP","https://worldwide.espacenet.com/publicationDetails/mosaics?CC=US&NR=2011081464A1&KC=A1&FT=D&ND=3&date=20110407&DB=&locale=fr_EP","https://worldwide.espacenet.com/publicationDetails/originalDocument?CC=US&NR=2011081464A1&KC=A1&FT=D&ND=3&date=20110407&DB=&locale=fr_EP","https://worldwide.espacenet.com/publicationDetails/citedDocuments?CC=US&NR=2011081464A1&KC=A1&FT=D&ND=3&date=20110407&DB=&locale=fr_EP","https://worldwide.espacenet.com/publicationDetails/citingDocuments?CC=US&NR=2011081464A1&KC=A1&FT=D&ND=3&date=20110407&DB=&locale=fr_EP","https://worldwide.espacenet.com/publicationDetails/inpadoc?CC=US&NR=2011081464A1&KC=A1&FT=D&ND=3&date=20110407&DB=&locale=fr_EP","https://worldwide.espacenet.com/publicationDetails/inpadocPatentFamily?CC=US&NR=2011081464A1&KC=A1&FT=D&ND=3&date=20110407&DB=&locale=fr_EP","15513","0","1","8"
"39","US2011061534 (A1)","US2011061534A1","BEVERAGE PRODUCTION DEVICE","2011-03-17","2008-05-08","THULIEZ JEAN-LUC [CH]; OZANNE MATTHIEU [FR]; VUAGNIAUX DIDIER [CH]; ROBERT THIERRY [CH]","(OZANNE MATTHIEU; VUAGNIAUX DIDIER; THULIEZ JEAN-LUC; ROBERT THIERRY; OZANNE MATTHIEU; VUAGNIAUX DIDIER; THULIEZ JEAN-LUC; ROBERT THIERRY)","THULIEZ JEAN-LUC [CH]; OZANNE MATTHIEU [FR]; NESTEC SA [CH]; VUAGNIAUX DIDIER [CH]; ROBERT THIERRY [CH]","(NESTEC S.A.; OZANNE MATTHIEU; VUAGNIAUX DIDIER; THULIEZ JEAN-LUC; ROBERT THIERRY; NESTEC S.A.)","Numéro de demande US20090991593 20090507 Dossier global","Numéro(s) de priorité: EP20080155882 20080508 ; WO2009EP55536 20090507 ;","Également publié en tant que: AU2009245745 (A1) BRPI0915055 (A2) CA2728578 (A1) CN102056524 (A) CN102056524 (B) plus AU2009245745 (A1) BRPI0915055 (A2) CA2728578 (A1) CN102056524 (A) CN102056524 (B) DK2276381 (T3) EP2276381 (A1) EP2276381 (B1) ES2430851 (T3) JP2011519644 (A) JP5422644 (B2) KR20110005304 (A) NZ588984 (A) PL2276381 (T3) PT2276381 (E) RU2010150144 (A) RU2489958 (C2) US8460440 (B2) WO2009135899 (A1) ZA201008802 (B) moins","Classification: - internationale A47J31/40; A47J31/44; B01D19/00 - coopérative A47J31/36 (KR); A47J31/461 (EP, KR, US); B01D19/0042 (EP, KR, US)","The invention as claimed shows a beverage production device (1) comprising a beverage production chamber (20) designed to have a liquid interact with a beverage ingredient (T) contained in a capsule, liquid supply means (8) for supplying liquid to said beverage production chamber (20), heating means (7) provided in the liquid supply means (8) for heating the liquid, and an air separating compartment (30) provided in the liquid supply means (8) after the heating means (7) for separating any air or other gas contained in the liquid, wherein the air separating compartment (30) comprises an inlet (35) for introducing liquid into the air separating compartment (30), means for breaking the kinetic energy of the liquid introduced through the inlet (35), a liquid outlet (37), separated from the inlet by the means for breaking the kinetic energy of the liquid introduced through the inlet (35), for evacuating liquid from the air separating compartment (30), and an air outlet (39), also separated from the inlet by the means for breaking the kinetic energy of the liquid introduced through the inlet (35), for evacuating air from the air separating compartment (30). Hence, a beverage production device (1) is provided having a reduced amount of air in the liquid used for extraction of the beverage ingredient (T).","https://worldwide.espacenet.com/publicationDetails/biblio?II=38&ND=3&adjacent=true&locale=fr_EP&FT=D&date=20110317&CC=US&NR=2011061534A1&KC=A1","https://worldwide.espacenet.com/publicationDetails/description?CC=US&NR=2011061534A1&KC=A1&FT=D&ND=3&date=20110317&DB=&locale=fr_EP","https://worldwide.espacenet.com/publicationDetails/claims?CC=US&NR=2011061534A1&KC=A1&FT=D&ND=3&date=20110317&DB=&locale=fr_EP","https://worldwide.espacenet.com/publicationDetails/mosaics?CC=US&NR=2011061534A1&KC=A1&FT=D&ND=3&date=20110317&DB=&locale=fr_EP","https://worldwide.espacenet.com/publicationDetails/originalDocument?CC=US&NR=2011061534A1&KC=A1&FT=D&ND=3&date=20110317&DB=&locale=fr_EP","https://worldwide.espacenet.com/publicationDetails/citedDocuments?CC=US&NR=2011061534A1&KC=A1&FT=D&ND=3&date=20110317&DB=&locale=fr_EP","https://worldwide.espacenet.com/publicationDetails/citingDocuments?CC=US&NR=2011061534A1&KC=A1&FT=D&ND=3&date=20110317&DB=&locale=fr_EP","https://worldwide.espacenet.com/publicationDetails/inpadoc?CC=US&NR=2011061534A1&KC=A1&FT=D&ND=3&date=20110317&DB=&locale=fr_EP","https://worldwide.espacenet.com/publicationDetails/inpadocPatentFamily?CC=US&NR=2011061534A1&KC=A1&FT=D&ND=3&date=20110317&DB=&locale=fr_EP","49997","0","1","13"
"40","CH701083 (B1)","CH701083B1","Dispositif pour le détartage et le blanchiment simultane des dents.","2010-11-30","2007-06-15","THULIEZ JEAN-LUC [CH]; CROZIER ETIENNE [CH]; VARIDEL CHRISTOPHE [CH]","(THULIEZ JEAN-LUC; GROZIER ETIENNE; VARIDEL CHRISTOPHE)","DENTOTECH AS [NO]","(DENTOTECH AS)","Numéro de demande CH20070000963 20070615","Numéro(s) de priorité: CH20070000963 20070615 ;","Également publié en tant que: CH701083 (B1) WO2008151457 (A1) CH701083 (B1) WO2008151457 (A1) moins","Classification: - internationale A61C3/025 - coopérative A61C19/066 (EP); A61C3/025 (EP)","[0001] L’invention concerne un dispositif (10) pour le détartrage et le blanchiment simultané sous pression des dents. Ce dispositif comporte un corps allongé (11), équipé à l’une de ses extrémités d’une tubulure de distribution (12) de particules solides de détartrage et de blanchiment, et fermé par un bouchon amovible (13). Le corps allongé (11) est agencé pour contenir une cartouche de détartrage et de blanchiment (14). Cette cartouche de détartrage et de blanchiment (14) est un élément indépendant, interchangeable et jetable qui peut être conçu pour un usage unique ou pour des usages répétés. Elle contient un réservoir de liquide, par exemple de l’eau déminéralisée ou de l’eau oxygénée, un réservoir de particules solides de détartrage et de blanchiment, et une source de gaz sous pression, appelé gaz propulseur. L’aspiration des particules solides de leur réservoir avant leur projection sous pression dans un canal de sortie est obtenue par un élément du type Venturi.[0002] <img class=""EMIRef"" id=""49390275-iaf0001"" />","https://worldwide.espacenet.com/publicationDetails/biblio?II=39&ND=3&adjacent=true&locale=fr_EP&FT=D&date=20101130&CC=CH&NR=701083B1&KC=B1","https://worldwide.espacenet.com/publicationDetails/description?CC=CH&NR=701083B1&KC=B1&FT=D&ND=3&date=20101130&DB=&locale=fr_EP","https://worldwide.espacenet.com/publicationDetails/claims?CC=CH&NR=701083B1&KC=B1&FT=D&ND=3&date=20101130&DB=&locale=fr_EP","https://worldwide.espacenet.com/publicationDetails/mosaics?CC=CH&NR=701083B1&KC=B1&FT=D&ND=3&date=20101130&DB=&locale=fr_EP","https://worldwide.espacenet.com/publicationDetails/originalDocument?CC=CH&NR=701083B1&KC=B1&FT=D&ND=3&date=20101130&DB=&locale=fr_EP","https://worldwide.espacenet.com/publicationDetails/citedDocuments?CC=CH&NR=701083B1&KC=B1&FT=D&ND=3&date=20101130&DB=&locale=fr_EP","https://worldwide.espacenet.com/publicationDetails/citingDocuments?CC=CH&NR=701083B1&KC=B1&FT=D&ND=3&date=20101130&DB=&locale=fr_EP","https://worldwide.espacenet.com/publicationDetails/inpadoc?CC=CH&NR=701083B1&KC=B1&FT=D&ND=3&date=20101130&DB=&locale=fr_EP","https://worldwide.espacenet.com/publicationDetails/inpadocPatentFamily?CC=CH&NR=701083B1&KC=B1&FT=D&ND=3&date=20101130&DB=&locale=fr_EP","17958","4465","2","13"
"41","EP2000065 (A1)","EP2000065A1","Device and method for producing a beverage by mixing soluble ingredients and a diluent","2008-12-10","2007-06-05","THULIEZ JEAN-LUC [CH]; KISSLING IWAN [CH]","(THULIEZ, JEAN-LUC; KISSLING, IWAN)","NESTEC SA [CH]","(NESTEC S.A.)","Numéro de demande EP20070109616 20070605 Dossier global","Numéro(s) de priorité: EP20070109616 20070605 ;","Également publié en tant que: EP2000065 (A1) AR066858 (A1) TW200927044 (A) WO2008148711 (A1) EP2000065 (A1) AR066858 (A1) TW200927044 (A) WO2008148711 (A1) moins","Classification: - internationale A47J31/40 - coopérative A47J31/401 (EP)","A device for mixing a soluble food or beverage ingredient and a diluent comprises: - a mixing chamber (13) (13) having an inlet (17) for the ingredient, an inlet (18) for the diluent and an outlet (20) for the beverage or comestible food resulting from the mixing of the ingredient with the diluent, - a reservoir (3) for the ingredient, the reservoir (3) being connected to the mixing chamber (13) via an ingredient flow path, and - air stream generating means designed for generating an stream of air from outside the mixing device and crossing the ingredient flow path, the air stream generating means comprising means for generating a low pressure zone (101) above the ingredient inlet opening (17).","https://worldwide.espacenet.com/publicationDetails/biblio?II=40&ND=3&adjacent=true&locale=fr_EP&FT=D&date=20081210&CC=EP&NR=2000065A1&KC=A1","https://worldwide.espacenet.com/publicationDetails/description?CC=EP&NR=2000065A1&KC=A1&FT=D&ND=3&date=20081210&DB=&locale=fr_EP","https://worldwide.espacenet.com/publicationDetails/claims?CC=EP&NR=2000065A1&KC=A1&FT=D&ND=3&date=20081210&DB=&locale=fr_EP","https://worldwide.espacenet.com/publicationDetails/mosaics?CC=EP&NR=2000065A1&KC=A1&FT=D&ND=3&date=20081210&DB=&locale=fr_EP","https://worldwide.espacenet.com/publicationDetails/originalDocument?CC=EP&NR=2000065A1&KC=A1&FT=D&ND=3&date=20081210&DB=&locale=fr_EP","https://worldwide.espacenet.com/publicationDetails/citedDocuments?CC=EP&NR=2000065A1&KC=A1&FT=D&ND=3&date=20081210&DB=&locale=fr_EP","https://worldwide.espacenet.com/publicationDetails/citingDocuments?CC=EP&NR=2000065A1&KC=A1&FT=D&ND=3&date=20081210&DB=&locale=fr_EP","https://worldwide.espacenet.com/publicationDetails/inpadoc?CC=EP&NR=2000065A1&KC=A1&FT=D&ND=3&date=20081210&DB=&locale=fr_EP","https://worldwide.espacenet.com/publicationDetails/inpadocPatentFamily?CC=EP&NR=2000065A1&KC=A1&FT=D&ND=3&date=20081210&DB=&locale=fr_EP","15580","6146","1","13"
"42","EP2129582 (A1)","EP2129582A1","METHOD FOR INERTING A CONTAINER WITH THE INJECTION OF AN INERT GAS AND DEVICE FOR IMPLEMENTING SAME","2009-12-09","2007-03-30","THULIEZ JEAN-LUC [CH]; RUSSO MICKAEL [FR]; ROBERT THIERRY [CH]; VARIDEL CHRISTOPHE [CH]","(THULIEZ, JEAN-LUC; ROBERT, THIERRY; RUSSO, MICKAEL; VARIDEL, CHRISTOPHE; THULIEZ, JEAN-LUC; ROBERT, THIERRY; RUSSO, MICKAEL; VARIDEL, CHRISTOPHE)","GRETHER PIERRE YVES [CH]","(GRETHER, PIERRE-YVES; GRETHER, PIERRE-YVES)","Numéro de demande EP20080706398 20080311 Dossier global","Numéro(s) de priorité: CH20070000514 20070330 ; WO2008CH00101 20080311 ;","Également publié en tant que: EP2129582 (A1) EP2129582 (B1) ATE547327 (T1) CH700700 (B1) WO2008119193 (A1) EP2129582 (A1) EP2129582 (B1) ATE547327 (T1) CH700700 (B1) WO2008119193 (A1) moins","Classification: - internationale B65B31/04; B65B31/08 - coopérative B65B31/042 (EP)","","https://worldwide.espacenet.com/publicationDetails/biblio?II=41&ND=3&adjacent=true&locale=fr_EP&FT=D&date=20091209&CC=EP&NR=2129582A1&KC=A1","https://worldwide.espacenet.com/publicationDetails/description?CC=EP&NR=2129582A1&KC=A1&FT=D&ND=3&date=20091209&DB=&locale=fr_EP","https://worldwide.espacenet.com/publicationDetails/claims?CC=EP&NR=2129582A1&KC=A1&FT=D&ND=3&date=20091209&DB=&locale=fr_EP","https://worldwide.espacenet.com/publicationDetails/mosaics?CC=EP&NR=2129582A1&KC=A1&FT=D&ND=3&date=20091209&DB=&locale=fr_EP","https://worldwide.espacenet.com/publicationDetails/originalDocument?CC=EP&NR=2129582A1&KC=A1&FT=D&ND=3&date=20091209&DB=&locale=fr_EP","https://worldwide.espacenet.com/publicationDetails/citedDocuments?CC=EP&NR=2129582A1&KC=A1&FT=D&ND=3&date=20091209&DB=&locale=fr_EP","https://worldwide.espacenet.com/publicationDetails/citingDocuments?CC=EP&NR=2129582A1&KC=A1&FT=D&ND=3&date=20091209&DB=&locale=fr_EP","https://worldwide.espacenet.com/publicationDetails/inpadoc?CC=EP&NR=2129582A1&KC=A1&FT=D&ND=3&date=20091209&DB=&locale=fr_EP","https://worldwide.espacenet.com/publicationDetails/inpadocPatentFamily?CC=EP&NR=2129582A1&KC=A1&FT=D&ND=3&date=20091209&DB=&locale=fr_EP","23408","6810","2","32"
"43","US2010173057 (A1)","US2010173057A1","DEVICE AND METHOD FOR PRODUCING A FROTHED LIQUID FROM SOLUBLE INGREDIENTS AND DILUENT","2010-07-08","2006-12-11","THULIEZ JEAN-LUC [CH]; DOGAN NIHAN [CH]; BEAUSIRE CEDRIC [CH]; KISSLING IWAN [CH]; HAMEL DAVID [CH]; BERNHARDSGRUETTER RAPHAEL [CH]; GUGERLI RAPHAEL [CH]; HARRISON DAVID J [US]","(GUGERLI RAPHAEL; THULIEZ JEAN-LUC; KISSLING IWAN; BERNHARDSGRUETTER RAPHAEL; BEAUSIRE CEDRIC; DOGAN NIHAN; HARRISON DAVID J.; HAMEL DAVID; GUGERLI RAPHAEL; THULIEZ JEAN-LUC; KISSLING IWAN; BERNHARDSGRUETTER RAPHAEL; BEAUSIRE CEDRIC; DOGAN NIHAN; HARRISON DAVID J.; HAMEL DAVID)","THULIEZ JEAN-LUC [CH]; DOGAN NIHAN [CH]; BEAUSIRE CEDRIC [CH]; KISSLING IWAN [CH]; HAMEL DAVID [CH]; NESTEC SA [CH]; BERNHARDSGRUETTER RAPHAEL [CH]; GUGERLI RAPHAEL [CH]; HARRISON DAVID J [US]","(NESTEC S.A.; GUGERLI RAPHAEL; THULIEZ JEAN-LUC; KISSLING IWAN; BERNHARDSGRUETTER RAPHAEL; BEAUSIRE CEDRIC; DOGAN NIHAN; HARRISON DAVID J.; HAMEL DAVID; NESTEC S.A.)","Numéro de demande US20070518675 20071206 Dossier global","Numéro(s) de priorité: EP20060125772 20061211 ; WO2007EP63391 20071206 ;","Également publié en tant que: AR064290 (A1) AU2007332588 (A1) AU2007332588 (B2) CA2673279 (A1) CA2673279 (C) plus AR064290 (A1) AU2007332588 (A1) AU2007332588 (B2) CA2673279 (A1) CA2673279 (C) CL2007003578 (A1) CN101600378 (A) CN101600378 (B) EP1932457 (A1) EP2091393 (A1) EP2091393 (B1) EP2653080 (A1) EP2653080 (B1) EP2653081 (A1) EP2653081 (B1) EP2653407 (A1) EP2653407 (B1) EP2907428 (A1) EP2907428 (B1) ES2430293 (T3) ES2545199 (T3) ES2673879 (T3) JP2010512207 (A) JP5422391 (B2) MX2009006128 (A) MX355514 (B) MX355516 (B) MY162226 (A) PE20081619 (A1) PL2091393 (T3) RU2009126593 (A) RU2462977 (C2) TW200911186 (A) TWI459921 (B) US2015110936 (A1) US2015128812 (A1) US8960079 (B2) US9307859 (B2) US9408495 (B2) UY30777 (A1) WO2008071613 (A1) ZA200904862 (B) moins","Classification: - internationale A23L1/00; A23L2/54; A47J31/40; B01F3/04 - coopérative A23F5/262 (EP, US); A23L2/54 (US); A23V2002/00 (US); A47J31/401 (EP, US); A47J31/404 (US); A47J31/407 (US); A47J31/46 (EP, US); A47J31/462 (US); B65D85/8049 (EP, US); B65D85/8052 (EP, US)","[0000] Device for producing a frothed liquid comprising a chamber 13 opened to atmosphere with a transverse bottom wall 14 and a longitudinal upward wall 15, at least one diluent inlet 18, at least one liquid delivery outlet 20, wherein the diluent inlet is provided through the upward wall and is dimensioned and oriented for directing a thin jet of diluent in the chamber, and wherein the at least one liquid delivery outlet is configured in the bottom wall for liquid to rise up along the side of the upward wall by the jet of diluent entering the chamber as a result of the direction and dimension of the diluent inlet in the chamber.","https://worldwide.espacenet.com/publicationDetails/biblio?II=42&ND=3&adjacent=true&locale=fr_EP&FT=D&date=20100708&CC=US&NR=2010173057A1&KC=A1","https://worldwide.espacenet.com/publicationDetails/description?CC=US&NR=2010173057A1&KC=A1&FT=D&ND=3&date=20100708&DB=&locale=fr_EP","https://worldwide.espacenet.com/publicationDetails/claims?CC=US&NR=2010173057A1&KC=A1&FT=D&ND=3&date=20100708&DB=&locale=fr_EP","https://worldwide.espacenet.com/publicationDetails/mosaics?CC=US&NR=2010173057A1&KC=A1&FT=D&ND=3&date=20100708&DB=&locale=fr_EP","https://worldwide.espacenet.com/publicationDetails/originalDocument?CC=US&NR=2010173057A1&KC=A1&FT=D&ND=3&date=20100708&DB=&locale=fr_EP","https://worldwide.espacenet.com/publicationDetails/citedDocuments?CC=US&NR=2010173057A1&KC=A1&FT=D&ND=3&date=20100708&DB=&locale=fr_EP","https://worldwide.espacenet.com/publicationDetails/citingDocuments?CC=US&NR=2010173057A1&KC=A1&FT=D&ND=3&date=20100708&DB=&locale=fr_EP","https://worldwide.espacenet.com/publicationDetails/inpadoc?CC=US&NR=2010173057A1&KC=A1&FT=D&ND=3&date=20100708&DB=&locale=fr_EP","https://worldwide.espacenet.com/publicationDetails/inpadocPatentFamily?CC=US&NR=2010173057A1&KC=A1&FT=D&ND=3&date=20100708&DB=&locale=fr_EP","41791","6717","2","20"
